{
  "schemaVersion": 2,
  "requestID": "battle-decision:7d0b0cc425180d993cda50459b8c0ae717140870631b7f86fc27ec720c7b48a7",
  "scope": {
    "campaign": "a8c24607-48a7-4e47-a204-4221a7367fcc",
    "branch": "ea8f2b20-57c1-49d0-b209-d935fbe38f9d",
    "nativeROM": "a7568526e6042b38b82bb82962218440bf519998d6601be954a574d4a1b2ed98",
    "nonce": 3029093765,
    "generation": 1,
    "battle": 1,
    "turn": 1,
    "battler": 1,
    "phase": "NORMAL_TURN",
    "request": 1
  },
  "actionSetHash": "96eb023d",
  "strategyID": "strategy-memo:33be555c211916cff4a9c97624ac6617b41342c181e7abb4c79b8206c9054423",
  "strategySHA256": "0b641fa6e17877ea6eb04bbc9748b08ca4974555a450c442ead7874700173131",
  "commitmentID": "commitment:9d98e58081246e82886f2605df0d07bf897a7b5a05daeb04e791f077975c4cc8",
  "state": "TRAINER / OWN STATE\n{\"activeSlot\": 0, \"commitmentID\": \"commitment:9d98e58081246e82886f2605df0d07bf897a7b5a05daeb04e791f077975c4cc8\", \"finiteInventory\": [0, 0, 0, 0], \"own\": [{\"ability\": 69, \"heldItem\": 0, \"hp\": 31, \"level\": 12, \"maxHP\": 31, \"maxPP\": [35, 40, 0, 0], \"moves\": [33, 111, 0, 0], \"pp\": [35, 40, 0, 0], \"slot\": 0, \"species\": 74, \"stages\": [6, 6, 6, 6, 6, 6, 6, 6], \"status\": 0, \"status2\": 0, \"status3\": 0, \"types\": [5, 4]}, {\"ability\": null, \"heldItem\": 0, \"hp\": 33, \"level\": 14, \"maxHP\": 33, \"maxPP\": [35, 20, 10, 0], \"moves\": [33, 20, 317, 0], \"pp\": [35, 20, 10, 0], \"slot\": 1, \"species\": 95, \"stages\": [], \"status\": 0, \"status2\": 0, \"status3\": 0, \"types\": [5, 4]}], \"trainerID\": 414}\n\nSTRATEGY MEMO \u2014 SUBJECTIVE\nI write as Brock, approaching my authored first encounter with the inventory, identity and evidence you have provided.\n\nMy roster is finite and locked: Geodude at level 12 with Effect Nightmare, Defense Curl and two vacant slots, and Onix at level 14 with Effect Nightmare, Bind and Rock Tomb. No acquisition is available; no items, moves or species may be added. The preparation envelope confirms two active companions, zero healing items and a move-change budget of two, which I may distribute only within the existing move sets. My signature attachment to Onix is strong, and I intend to retain that bond while using the budget to optimize the moves I already have.\n\nThe social evidence I have is limited to a single reported battle and a Pok\u00e9mon-seen post, both from trainer:fr:trainer:0102, sourced from pokebook. A repeated report from one original source is not independent corroboration, and I do not treat it as such. The battle outcome was favorable to the reporter, and the species seen was Bulbasaur, but I cannot infer a pattern or predict the next opponent from this alone. I accept uncertainty about the unseen player party, unannounced moves and the order of future actions.\n\nMy strategy proceeds from caution and resource conservation. I will lead with Geodude, using Effect Nightmare to apply pressure early, then shift to Onix to leverage Rock Tomb for coverage and Bind for sustained control. I will pace setup patiently, accept that the next opponent and their party are unknown, and rely on the moderate aggression and caution baked into my behavioral reference. I do not select a candidate move, switch or item beyond what is legally present; I simply execute the roster I have, preserving my original companions and signature lineage.\n\nAUTHORIZED FACTS\n{\"actorID\":\"trainer:fr:trainer:0414\",\"authorizedFacts\":[{\"attribution\":{\"attribution\":\"reported\",\"channel\":\"pokebook\",\"kind\":\"published_post\",\"postID\":\"11e722419022a5e2dc016ab285df168642f3a742a7456f181e9e24580d37c6fa\",\"sender\":\"trainer:fr:trainer:0102\"},\"claim\":{\"battleID\":\"e0d252b9e636c09890acb93314e569a61cf05596e85c2f5c767fadc34f9ca0f4\",\"nativeOutcome\":1,\"trainerID\":\"fr:trainer:0102\",\"type\":\"TRAINER_BATTLE_RESULT\"},\"evidenceID\":\"7167fbf16edbf7d8e333a73e8922b57b4566a7e3b49fdf47d9dc323f484cf209\",\"evidenceQuality\":{\"attribution\":\"reported\",\"campaignDistance\":1,\"channel\":\"pokebook\",\"currentRelevance\":\"CURRENT\",\"independentOriginCount\":1,\"organizationalFidelity\":null,\"originStage\":\"forest\",\"originalSourceActor\":\"trainer:fr:trainer:0102\",\"path\":null,\"publicationLag\":0,\"publicationOrder\":1,\"socialDegree\":null,\"sourceActor\":\"trainer:fr:trainer:0102\",\"sourceQuality\":\"HIGH\",\"version\":1},\"mode\":\"delivered\"},{\"attribution\":{\"attribution\":\"reported\",\"channel\":\"pokebook\",\"kind\":\"published_post\",\"postID\":\"11e722419022a5e2dc016ab285df168642f3a742a7456f181e9e24580d37c6fa\",\"sender\":\"trainer:fr:trainer:0102\"},\"claim\":{\"battleID\":\"e0d252b9e636c09890acb93314e569a61cf05596e85c2f5c767fadc34f9ca0f4\",\"speciesID\":1,\"trainerID\":\"fr:trainer:0102\",\"type\":\"POKEMON_SEEN\"},\"evidenceID\":\"c46276f23d5f2f57401e03ed2902a7af77a454b9b997d4be2bc42f7dc5381894\",\"evidenceQuality\":{\"attribution\":\"reported\",\"campaignDistance\":1,\"channel\":\"pokebook\",\"currentRelevance\":\"CURRENT\",\"independentOriginCount\":1,\"organizationalFidelity\":null,\"originStage\":\"forest\",\"originalSourceActor\":\"trainer:fr:trainer:0102\",\"path\":null,\"publicationLag\":0,\"publicationOrder\":1,\"socialDegree\":null,\"sourceActor\":\"trainer:fr:trainer:0102\",\"sourceQuality\":\"HIGH\",\"version\":1},\"mode\":\"delivered\"}],\"schemaVersion\":3,\"truncated\":false,\"unknowns\":[\"unseen player party\",\"unannounced moves/items\",\"future input\",\"damage RNG\"]}\n\nCURRENT BATTLE\n{\"opponent\": {\"hpBar\": 48, \"revealedMoves\": [0, 0, 0, 0], \"species\": 1, \"status\": 0}, \"phase\": \"NORMAL_TURN\", \"turn\": 1, \"weather\": 0}\n\nRECENT HISTORY \u2014 CHRONOLOGICAL, AT MOST 16 RESOLVED ACTIONS\n[]\n\nLEGAL ACTIONS\n1:1:NORMAL_TURN:1:1:96eb023d:MOVE:0 \u2014 Use Tackle (move 33, slot 0, PP 35/35, type 0, power 35, accuracy 95, effect 0, target battler 0).\n1:1:NORMAL_TURN:1:1:96eb023d:MOVE:1 \u2014 Use Defense Curl (move 111, slot 1, PP 40/40, type 0, power 0, accuracy 0, effect 156, target battler 1).\n1:1:NORMAL_TURN:1:1:96eb023d:SWITCH:1 \u2014 Switch with own slot 1 lineage trainer:fr:trainer:0414:baseline:414:1: Onix, level 14, HP 33/33, status 0, types [5, 4], moves [33, 20, 317, 0], PP [35, 20, 10, 0].\n\nAUTHORED TRAINER PERSONALITY \u2014 FROZEN STRATEGY CONTEXT\n{\"identity\": \"Pewter Rock Gym Leader; patient, proud of sturdy original partners\", \"reference\": \"brock-scouting-opening-v1\", \"resourceConservation\": \"strong\", \"scouting\": \"reads public battle reports, considers status and pacing, accepts uncertainty about the next opponent\", \"setupPatience\": \"strong\", \"signatureAttachment\": \"strong\"}",
  "choices": {
    "1:1:NORMAL_TURN:1:1:96eb023d:MOVE:0": "Use Tackle (move 33, slot 0, PP 35/35, type 0, power 35, accuracy 95, effect 0, target battler 0).",
    "1:1:NORMAL_TURN:1:1:96eb023d:MOVE:1": "Use Defense Curl (move 111, slot 1, PP 40/40, type 0, power 0, accuracy 0, effect 156, target battler 1).",
    "1:1:NORMAL_TURN:1:1:96eb023d:SWITCH:1": "Switch with own slot 1 lineage trainer:fr:trainer:0414:baseline:414:1: Onix, level 14, HP 33/33, status 0, types [5, 4], moves [33, 20, 317, 0], PP [35, 20, 10, 0]."
  },
  "nativeActions": {
    "1:1:NORMAL_TURN:1:1:96eb023d:MOVE:0": 256,
    "1:1:NORMAL_TURN:1:1:96eb023d:MOVE:1": 257,
    "1:1:NORMAL_TURN:1:1:96eb023d:SWITCH:1": 513
  },
  "nativeState": {
    "trainerID": 414,
    "phase": "NORMAL_TURN",
    "battle": 1,
    "request": 1,
    "nonce": 3029093765,
    "generation": 1,
    "turn": 1,
    "battler": 1,
    "activeSlot": 0,
    "moveMask": 12,
    "opponent": {
      "species": 1,
      "hpBar": 48,
      "status": 0,
      "revealedMoves": [
        0,
        0,
        0,
        0
      ]
    },
    "weather": 0,
    "inventory": [
      0,
      0,
      0,
      0
    ],
    "own": [
      {
        "slot": 0,
        "species": 74,
        "hp": 31,
        "maxHP": 31,
        "heldItem": 0,
        "moves": [
          33,
          111,
          0,
          0
        ],
        "status": 0,
        "status2": 0,
        "status3": 0,
        "level": 12,
        "types": [
          5,
          4
        ],
        "ability": 69,
        "pp": [
          35,
          40,
          0,
          0
        ],
        "maxPP": [
          35,
          40,
          0,
          0
        ],
        "stages": [
          6,
          6,
          6,
          6,
          6,
          6,
          6,
          6
        ]
      },
      {
        "slot": 1,
        "species": 95,
        "hp": 33,
        "maxHP": 33,
        "heldItem": 0,
        "moves": [
          33,
          20,
          317,
          0
        ],
        "status": 0,
        "status2": 0,
        "status3": 0,
        "level": 14,
        "types": [
          5,
          4
        ],
        "ability": null,
        "pp": [
          35,
          20,
          10,
          0
        ],
        "maxPP": [
          35,
          20,
          10,
          0
        ],
        "stages": []
      }
    ],
    "actions": [
      {
        "nativeID": 256,
        "kind": "MOVE",
        "slot": 0,
        "value": 33,
        "target": 0,
        "flags": 0
      },
      {
        "nativeID": 257,
        "kind": "MOVE",
        "slot": 1,
        "value": 111,
        "target": 1,
        "flags": 0
      },
      {
        "nativeID": 513,
        "kind": "SWITCH",
        "slot": 1,
        "value": 95,
        "target": 1,
        "flags": 0
      }
    ],
    "history": []
  },
  "question": "Which supplied legal action best pursues this trainer\u2019s subjective strategy?"
}
